{
  "id": "v30_turbo",
  "name": "R6 3.0 Biturbo 24V",
  "kind": "GasolineTurbo",
  "cylinders": 6,
  "displacementL": 2.979,
  "boreMm": 84,
  "strokeMm": 89.6,
  "compressionRatio": 10.2,
  "firingOrder": [1, 5, 3, 6, 2, 4],
  "redlineRpm": 7000,
  "mechanicalLimitRpm": 7600,
  "throttleDiameterMm": 74,
  "inertiaKgM2": 0.21,
  "knockMarginDeg": -2,
  "fuelRon": 98,
  "injectorFlowCcMin": 550,
  "injectorRefPressureKpa": 400,
  "railPressureKpa": 400,
  "pumpMaxPressureKpa": 720,
  "thermalCapacityKjK": 60,
  "thermostatOpenC": 90,
  "radiatorKwK": 1.2,
  "frictionFactor": 1,
  "indicatedEfficiency": 0.39,
  "ve": {
    "id": "ve",
    "unit": "fraction",
    "x": {
      "name": "rpm",
      "unit": "rpm",
      "values": [800, 1200, 1600, 2000, 2500, 3000, 3500, 4000, 4500, 5000, 5500, 6000, 6500, 7000, 7500]
    },
    "y": {
      "name": "map",
      "unit": "kPa",
      "values": [20, 40, 60, 80, 100, 130, 160, 200, 250]
    },
    "values": [
      [0.6392, 0.6765, 0.7099, 0.7394, 0.7707, 0.7959, 0.8149, 0.8278, 0.8345, 0.8343, 0.8195, 0.7881, 0.7403, 0.6759, 0.5951],
      [0.6832, 0.7231, 0.7588, 0.7903, 0.8238, 0.8507, 0.8711, 0.8848, 0.8921, 0.8918, 0.876, 0.8425, 0.7913, 0.7225, 0.6361],
      [0.7205, 0.7625, 0.8002, 0.8334, 0.8687, 0.8971, 0.9185, 0.933, 0.9406, 0.9404, 0.9237, 0.8883, 0.8344, 0.7619, 0.6708],
      [0.7492, 0.7929, 0.8321, 0.8666, 0.9033, 0.9328, 0.9551, 0.9702, 0.9782, 0.9779, 0.9605, 0.9238, 0.8677, 0.7923, 0.6975],
      [0.7649, 0.8096, 0.8495, 0.8848, 0.9223, 0.9524, 0.9752, 0.9906, 0.9987, 0.9984, 0.9807, 0.9431, 0.8859, 0.8089, 0.7121],
      [0.7649, 0.8096, 0.8495, 0.8848, 0.9223, 0.9524, 0.9752, 0.9906, 0.9987, 0.9984, 0.9807, 0.9431, 0.8859, 0.8089, 0.7121],
      [0.7649, 0.8096, 0.8495, 0.8848, 0.9223, 0.9524, 0.9752, 0.9906, 0.9987, 0.9984, 0.9807, 0.9431, 0.8859, 0.8089, 0.7121],
      [0.7649, 0.8096, 0.8495, 0.8848, 0.9223, 0.9524, 0.9752, 0.9906, 0.9987, 0.9984, 0.9807, 0.9431, 0.8859, 0.8089, 0.7121],
      [0.7649, 0.8096, 0.8495, 0.8848, 0.9223, 0.9524, 0.9752, 0.9906, 0.9987, 0.9984, 0.9807, 0.9431, 0.8859, 0.8089, 0.7121]
    ]
  },
  "mbt": {
    "id": "mbt",
    "unit": "deg",
    "x": {
      "name": "rpm",
      "unit": "rpm",
      "values": [800, 1200, 1600, 2000, 2500, 3000, 3500, 4000, 4500, 5000, 5500, 6000, 6500, 7000, 7500]
    },
    "y": {
      "name": "load",
      "unit": "rel",
      "values": [0.1, 0.2, 0.35, 0.5, 0.7, 0.9, 1.1, 1.4, 1.7, 2, 2.4]
    },
    "values": [
      [33, 37.4, 37.8, 38.2, 38.7, 39.2, 39.7, 40.2, 40.7, 41.2, 41.7, 42.2, 42.7, 43.2, 43.7],
      [31.7, 36.1, 36.5, 36.9, 37.4, 37.9, 38.4, 38.9, 39.4, 39.9, 40.4, 40.9, 41.4, 41.9, 42.4],
      [29.75, 34.15, 34.55, 34.95, 35.45, 35.95, 36.45, 36.95, 37.45, 37.95, 38.45, 38.95, 39.45, 39.95, 40.45],
      [27.8, 32.2, 32.6, 33, 33.5, 34, 34.5, 35, 35.5, 36, 36.5, 37, 37.5, 38, 38.5],
      [25.2, 29.6, 30, 30.4, 30.9, 31.4, 31.9, 32.4, 32.9, 33.4, 33.9, 34.4, 34.9, 35.4, 35.9],
      [22.6, 27, 27.4, 27.8, 28.3, 28.8, 29.3, 29.8, 30.3, 30.8, 31.3, 31.8, 32.3, 32.8, 33.3],
      [21, 25.4, 25.8, 26.2, 26.7, 27.2, 27.7, 28.2, 28.7, 29.2, 29.7, 30.2, 30.7, 31.2, 31.7],
      [20.1, 24.5, 24.9, 25.3, 25.8, 26.3, 26.8, 27.3, 27.8, 28.3, 28.8, 29.3, 29.8, 30.3, 30.8],
      [19.2, 23.6, 24, 24.4, 24.9, 25.4, 25.9, 26.4, 26.9, 27.4, 27.9, 28.4, 28.9, 29.4, 29.9],
      [18.3, 22.7, 23.1, 23.5, 24, 24.5, 25, 25.5, 26, 26.5, 27, 27.5, 28, 28.5, 29],
      [17.1, 21.5, 21.9, 22.3, 22.8, 23.3, 23.8, 24.3, 24.8, 25.3, 25.8, 26.3, 26.8, 27.3, 27.8]
    ]
  },
  "turbo": {
    "maxBoostKpa": 150,
    "fullSpoolRpm": 2100,
    "spoolStartRpm": 1200,
    "wastegateSpringKpa": 45,
    "maxSafeBoostKpa": 165,
    "compressorEfficiency": 0.74,
    "intercoolerEffectiveness": 0.75,
    "spoolTimeConstant": 0.35,
    "maxFlowGps": 330
  }
}
