{
  "id": "k16_vvt",
  "name": "K16 1.6 16V con distribución variable (atmosférico)",
  "kind": "GasolineNA",
  "cylinders": 4,
  "displacementL": 1.598,
  "boreMm": 78,
  "strokeMm": 83.6,
  "compressionRatio": 11,
  "firingOrder": [1, 3, 4, 2],
  "redlineRpm": 6500,
  "mechanicalLimitRpm": 7000,
  "throttleDiameterMm": 52,
  "inertiaKgM2": 0.12,
  "knockMarginDeg": -1,
  "fuelRon": 95,
  "injectorFlowCcMin": 190,
  "injectorRefPressureKpa": 350,
  "railPressureKpa": 350,
  "pumpMaxPressureKpa": 600,
  "thermalCapacityKjK": 36,
  "thermostatOpenC": 88,
  "radiatorKwK": 0.5,
  "frictionFactor": 0.88,
  "indicatedEfficiency": 0.405,
  "ve": {
    "id": "ve",
    "unit": "fraction",
    "x": {
      "name": "rpm",
      "unit": "rpm",
      "values": [800, 1200, 1600, 2000, 2500, 3000, 3500, 4000, 4500, 5000, 5500, 6000, 6500, 7000, 7500]
    },
    "y": {
      "name": "map",
      "unit": "kPa",
      "values": [15, 25, 40, 55, 70, 85, 100, 110]
    },
    "values": [
      [0.6058, 0.6412, 0.6728, 0.7008, 0.7304, 0.7543, 0.7723, 0.7846, 0.791, 0.7902, 0.7702, 0.7279, 0.6633, 0.5765, 0.4674],
      [0.6317, 0.6686, 0.7016, 0.7307, 0.7617, 0.7866, 0.8054, 0.8181, 0.8248, 0.824, 0.8031, 0.759, 0.6917, 0.6012, 0.4874],
      [0.6674, 0.7064, 0.7413, 0.7721, 0.8047, 0.831, 0.8509, 0.8644, 0.8714, 0.8706, 0.8485, 0.8019, 0.7308, 0.6352, 0.515],
      [0.6989, 0.7397, 0.7762, 0.8085, 0.8427, 0.8702, 0.891, 0.9051, 0.9125, 0.9117, 0.8886, 0.8398, 0.7653, 0.6651, 0.5393],
      [0.7255, 0.7679, 0.8058, 0.8392, 0.8748, 0.9033, 0.9249, 0.9396, 0.9472, 0.9464, 0.9224, 0.8717, 0.7944, 0.6904, 0.5598],
      [0.746, 0.7896, 0.8286, 0.863, 0.8995, 0.9289, 0.9511, 0.9661, 0.974, 0.9731, 0.9485, 0.8964, 0.8169, 0.7099, 0.5756],
      [0.7572, 0.8015, 0.841, 0.876, 0.913, 0.9429, 0.9654, 0.9807, 0.9887, 0.9878, 0.9627, 0.9099, 0.8292, 0.7206, 0.5843],
      [0.7572, 0.8015, 0.841, 0.876, 0.913, 0.9429, 0.9654, 0.9807, 0.9887, 0.9878, 0.9627, 0.9099, 0.8292, 0.7206, 0.5843]
    ]
  },
  "mbt": {
    "id": "mbt",
    "unit": "deg",
    "x": {
      "name": "rpm",
      "unit": "rpm",
      "values": [800, 1200, 1600, 2000, 2500, 3000, 3500, 4000, 4500, 5000, 5500, 6000, 6500, 7000, 7500]
    },
    "y": {
      "name": "load",
      "unit": "rel",
      "values": [0.1, 0.2, 0.3, 0.4, 0.55, 0.7, 0.85, 1, 1.1]
    },
    "values": [
      [34.73, 39.17, 39.61, 40.05, 40.6, 41.15, 41.7, 42.25, 42.8, 43.35, 43.9, 44.45, 45, 45, 45],
      [33.33, 37.77, 38.21, 38.65, 39.2, 39.75, 40.3, 40.85, 41.4, 41.95, 42.5, 43.05, 43.6, 44.15, 44.7],
      [31.93, 36.37, 36.81, 37.25, 37.8, 38.35, 38.9, 39.45, 40, 40.55, 41.1, 41.65, 42.2, 42.75, 43.3],
      [30.53, 34.97, 35.41, 35.85, 36.4, 36.95, 37.5, 38.05, 38.6, 39.15, 39.7, 40.25, 40.8, 41.35, 41.9],
      [28.43, 32.87, 33.31, 33.75, 34.3, 34.85, 35.4, 35.95, 36.5, 37.05, 37.6, 38.15, 38.7, 39.25, 39.8],
      [26.33, 30.77, 31.21, 31.65, 32.2, 32.75, 33.3, 33.85, 34.4, 34.95, 35.5, 36.05, 36.6, 37.15, 37.7],
      [24.23, 28.67, 29.11, 29.55, 30.1, 30.65, 31.2, 31.75, 32.3, 32.85, 33.4, 33.95, 34.5, 35.05, 35.6],
      [22.13, 26.57, 27.01, 27.45, 28, 28.55, 29.1, 29.65, 30.2, 30.75, 31.3, 31.85, 32.4, 32.95, 33.5],
      [21.83, 26.27, 26.71, 27.15, 27.7, 28.25, 28.8, 29.35, 29.9, 30.45, 31, 31.55, 32.1, 32.65, 33.2]
    ]
  }
}
