{
  "id": "g15_gdi",
  "name": "G15 1.5 Turbo GDI 16V con distribución variable",
  "kind": "GasolineTurbo",
  "cylinders": 4,
  "displacementL": 1.498,
  "boreMm": 74.5,
  "strokeMm": 85.9,
  "compressionRatio": 10.5,
  "firingOrder": [1, 3, 4, 2],
  "redlineRpm": 6300,
  "mechanicalLimitRpm": 6900,
  "throttleDiameterMm": 52,
  "inertiaKgM2": 0.12,
  "knockMarginDeg": -1.5,
  "fuelRon": 95,
  "injectorFlowCcMin": 900,
  "injectorRefPressureKpa": 10000,
  "railPressureKpa": 10000,
  "pumpMaxPressureKpa": 600,
  "thermalCapacityKjK": 38,
  "thermostatOpenC": 95,
  "radiatorKwK": 0.7,
  "frictionFactor": 0.9,
  "indicatedEfficiency": 0.41,
  "directInjection": true,
  "ve": {
    "id": "ve",
    "unit": "fraction",
    "x": {
      "name": "rpm",
      "unit": "rpm",
      "values": [800, 1200, 1600, 2000, 2500, 3000, 3500, 4000, 4500, 5000, 5500, 6000, 6500, 7000, 7500]
    },
    "y": {
      "name": "map",
      "unit": "kPa",
      "values": [20, 40, 60, 80, 100, 130, 160, 200, 250]
    },
    "values": [
      [0.7106, 0.7376, 0.7607, 0.7799, 0.7986, 0.8112, 0.8179, 0.8178, 0.8053, 0.779, 0.7387, 0.6846, 0.6166, 0.5347, 0.4389],
      [0.7596, 0.7884, 0.8131, 0.8337, 0.8536, 0.8672, 0.8742, 0.8742, 0.8608, 0.8327, 0.7896, 0.7318, 0.6591, 0.5716, 0.4692],
      [0.801, 0.8314, 0.8574, 0.8791, 0.9001, 0.9144, 0.9218, 0.9218, 0.9077, 0.878, 0.8326, 0.7716, 0.695, 0.6027, 0.4948],
      [0.8329, 0.8645, 0.8916, 0.9142, 0.936, 0.9508, 0.9586, 0.9586, 0.9439, 0.913, 0.8658, 0.8024, 0.7227, 0.6267, 0.5145],
      [0.8504, 0.8827, 0.9103, 0.9333, 0.9557, 0.9708, 0.9787, 0.9787, 0.9637, 0.9322, 0.884, 0.8192, 0.7379, 0.6399, 0.5253],
      [0.8504, 0.8827, 0.9103, 0.9333, 0.9557, 0.9708, 0.9787, 0.9787, 0.9637, 0.9322, 0.884, 0.8192, 0.7379, 0.6399, 0.5253],
      [0.8504, 0.8827, 0.9103, 0.9333, 0.9557, 0.9708, 0.9787, 0.9787, 0.9637, 0.9322, 0.884, 0.8192, 0.7379, 0.6399, 0.5253],
      [0.8504, 0.8827, 0.9103, 0.9333, 0.9557, 0.9708, 0.9787, 0.9787, 0.9637, 0.9322, 0.884, 0.8192, 0.7379, 0.6399, 0.5253],
      [0.8504, 0.8827, 0.9103, 0.9333, 0.9557, 0.9708, 0.9787, 0.9787, 0.9637, 0.9322, 0.884, 0.8192, 0.7379, 0.6399, 0.5253]
    ]
  },
  "mbt": {
    "id": "mbt",
    "unit": "deg",
    "x": {
      "name": "rpm",
      "unit": "rpm",
      "values": [800, 1200, 1600, 2000, 2500, 3000, 3500, 4000, 4500, 5000, 5500, 6000, 6500, 7000, 7500]
    },
    "y": {
      "name": "load",
      "unit": "rel",
      "values": [0.1, 0.2, 0.35, 0.5, 0.7, 0.9, 1.1, 1.4, 1.7, 2, 2.4]
    },
    "values": [
      [32.9, 37.3, 37.7, 38.1, 38.6, 39.1, 39.6, 40.1, 40.6, 41.1, 41.6, 42.1, 42.6, 43.1, 43.6],
      [31.5, 35.9, 36.3, 36.7, 37.2, 37.7, 38.2, 38.7, 39.2, 39.7, 40.2, 40.7, 41.2, 41.7, 42.2],
      [29.4, 33.8, 34.2, 34.6, 35.1, 35.6, 36.1, 36.6, 37.1, 37.6, 38.1, 38.6, 39.1, 39.6, 40.1],
      [27.3, 31.7, 32.1, 32.5, 33, 33.5, 34, 34.5, 35, 35.5, 36, 36.5, 37, 37.5, 38],
      [24.5, 28.9, 29.3, 29.7, 30.2, 30.7, 31.2, 31.7, 32.2, 32.7, 33.2, 33.7, 34.2, 34.7, 35.2],
      [21.7, 26.1, 26.5, 26.9, 27.4, 27.9, 28.4, 28.9, 29.4, 29.9, 30.4, 30.9, 31.4, 31.9, 32.4],
      [20, 24.4, 24.8, 25.2, 25.7, 26.2, 26.7, 27.2, 27.7, 28.2, 28.7, 29.2, 29.7, 30.2, 30.7],
      [19.1, 23.5, 23.9, 24.3, 24.8, 25.3, 25.8, 26.3, 26.8, 27.3, 27.8, 28.3, 28.8, 29.3, 29.8],
      [18.2, 22.6, 23, 23.4, 23.9, 24.4, 24.9, 25.4, 25.9, 26.4, 26.9, 27.4, 27.9, 28.4, 28.9],
      [17.3, 21.7, 22.1, 22.5, 23, 23.5, 24, 24.5, 25, 25.5, 26, 26.5, 27, 27.5, 28],
      [16.1, 20.5, 20.9, 21.3, 21.8, 22.3, 22.8, 23.3, 23.8, 24.3, 24.8, 25.3, 25.8, 26.3, 26.8]
    ]
  },
  "turbo": {
    "maxBoostKpa": 140,
    "fullSpoolRpm": 1800,
    "spoolStartRpm": 1100,
    "wastegateSpringKpa": 35,
    "maxSafeBoostKpa": 160,
    "compressorEfficiency": 0.73,
    "intercoolerEffectiveness": 0.7,
    "spoolTimeConstant": 0.35,
    "maxFlowGps": 160
  }
}
