{
  "id": "d16_crd",
  "name": "D16 1.6 CRD common rail con turbo de geometría variable, EGR y FAP",
  "kind": "DieselTurbo",
  "cylinders": 4,
  "displacementL": 1.598,
  "boreMm": 79.5,
  "strokeMm": 80.5,
  "compressionRatio": 16,
  "firingOrder": [1, 3, 4, 2],
  "redlineRpm": 4700,
  "mechanicalLimitRpm": 5200,
  "throttleDiameterMm": 55,
  "inertiaKgM2": 0.19,
  "knockMarginDeg": 0,
  "fuelRon": 95,
  "injectorFlowCcMin": 780,
  "injectorRefPressureKpa": 180000,
  "railPressureKpa": 180000,
  "pumpMaxPressureKpa": 650,
  "thermalCapacityKjK": 44,
  "thermostatOpenC": 87,
  "radiatorKwK": 0.7,
  "frictionFactor": 1.1,
  "indicatedEfficiency": 0.44,
  "ve": {
    "id": "ve",
    "unit": "fraction",
    "x": {
      "name": "rpm",
      "unit": "rpm",
      "values": [800, 1200, 1600, 2000, 2500, 3000, 3500, 4000, 4500, 5000, 5500, 6000, 6500, 7000, 7500]
    },
    "y": {
      "name": "map",
      "unit": "kPa",
      "values": [20, 40, 60, 80, 100, 130, 160, 200, 250]
    },
    "values": [
      [0.8542, 0.8688, 0.8792, 0.8855, 0.8872, 0.8756, 0.8474, 0.8026, 0.7412, 0.6633, 0.5687, 0.4576, 0.35, 0.35, 0.35],
      [0.8685, 0.8833, 0.8939, 0.9003, 0.9021, 0.8903, 0.8616, 0.8161, 0.7537, 0.6744, 0.5783, 0.4653, 0.35, 0.35, 0.35],
      [0.8806, 0.8956, 0.9064, 0.9128, 0.9146, 0.9027, 0.8736, 0.8274, 0.7642, 0.6838, 0.5863, 0.4717, 0.35, 0.35, 0.35],
      [0.8899, 0.9051, 0.916, 0.9225, 0.9243, 0.9122, 0.8829, 0.8362, 0.7723, 0.691, 0.5925, 0.4768, 0.35, 0.35, 0.35],
      [0.895, 0.9103, 0.9213, 0.9278, 0.9297, 0.9175, 0.8879, 0.841, 0.7767, 0.695, 0.5959, 0.4795, 0.35, 0.35, 0.35],
      [0.895, 0.9103, 0.9213, 0.9278, 0.9297, 0.9175, 0.8879, 0.841, 0.7767, 0.695, 0.5959, 0.4795, 0.35, 0.35, 0.35],
      [0.895, 0.9103, 0.9213, 0.9278, 0.9297, 0.9175, 0.8879, 0.841, 0.7767, 0.695, 0.5959, 0.4795, 0.35, 0.35, 0.35],
      [0.895, 0.9103, 0.9213, 0.9278, 0.9297, 0.9175, 0.8879, 0.841, 0.7767, 0.695, 0.5959, 0.4795, 0.35, 0.35, 0.35],
      [0.895, 0.9103, 0.9213, 0.9278, 0.9297, 0.9175, 0.8879, 0.841, 0.7767, 0.695, 0.5959, 0.4795, 0.35, 0.35, 0.35]
    ]
  },
  "mbt": {
    "id": "mbt",
    "unit": "deg",
    "x": {
      "name": "rpm",
      "unit": "rpm",
      "values": [800, 1200, 1600, 2000, 2500, 3000, 3500, 4000, 4500, 5000, 5500, 6000, 6500, 7000, 7500]
    },
    "y": {
      "name": "load",
      "unit": "rel",
      "values": [0.1, 0.2, 0.35, 0.5, 0.7, 0.9, 1.1, 1.4, 1.7, 2, 2.4]
    },
    "values": [
      [8, 10.82, 11.06, 11.3, 11.6, 11.9, 12.2, 12.5, 12.8, 13.1, 13.4, 13.7, 14, 14.3, 14.6],
      [8, 10.42, 10.66, 10.9, 11.2, 11.5, 11.8, 12.1, 12.4, 12.7, 13, 13.3, 13.6, 13.9, 14.2],
      [8, 9.82, 10.06, 10.3, 10.6, 10.9, 11.2, 11.5, 11.8, 12.1, 12.4, 12.7, 13, 13.3, 13.6],
      [8, 9.22, 9.46, 9.7, 10, 10.3, 10.6, 10.9, 11.2, 11.5, 11.8, 12.1, 12.4, 12.7, 13],
      [8, 8.42, 8.66, 8.9, 9.2, 9.5, 9.8, 10.1, 10.4, 10.7, 11, 11.3, 11.6, 11.9, 12.2],
      [8, 8, 8, 8.1, 8.4, 8.7, 9, 9.3, 9.6, 9.9, 10.2, 10.5, 10.8, 11.1, 11.4],
      [8, 8, 8, 8, 8, 8, 8.3, 8.6, 8.9, 9.2, 9.5, 9.8, 10.1, 10.4, 10.7],
      [8, 8, 8, 8, 8, 8, 8, 8, 8, 8.3, 8.6, 8.9, 9.2, 9.5, 9.8],
      [8, 8, 8, 8, 8, 8, 8, 8, 8, 8, 8, 8, 8.3, 8.6, 8.9],
      [8, 8, 8, 8, 8, 8, 8, 8, 8, 8, 8, 8, 8, 8, 8],
      [8, 8, 8, 8, 8, 8, 8, 8, 8, 8, 8, 8, 8, 8, 8]
    ]
  },
  "turbo": {
    "maxBoostKpa": 170,
    "fullSpoolRpm": 1700,
    "spoolStartRpm": 1000,
    "wastegateSpringKpa": 20,
    "maxSafeBoostKpa": 190,
    "compressorEfficiency": 0.74,
    "intercoolerEffectiveness": 0.74,
    "spoolTimeConstant": 0.4,
    "maxFlowGps": 160
  }
}
